{
  "$schema": "https://json-schema.org/draft/2020-12/schema",
  "$id": "command-result.schema.json",
  "title": "Codex Game Atelier command result",
  "type": "object",
  "additionalProperties": false,
  "required": ["schema_version", "run_id", "command", "outcome", "started_at", "finished_at", "duration_ms", "exit_code", "summary", "errors", "evidence", "data"],
  "properties": {
    "schema_version": { "$ref": "common.schema.json#/$defs/schemaVersion" },
    "run_id": { "$ref": "common.schema.json#/$defs/identifier" },
    "command": {
      "type": "object",
      "additionalProperties": false,
      "required": ["name", "arguments"],
      "properties": {
        "name": { "type": "string", "pattern": "^[a-z][a-z0-9-]*(?: [a-z][a-z0-9-]*)*$" },
        "arguments": { "type": "object", "additionalProperties": true }
      }
    },
    "outcome": {
      "type": "string",
      "enum": ["PASS", "FAIL", "BLOCKED", "SKIPPED"]
    },
    "started_at": { "$ref": "common.schema.json#/$defs/timestamp" },
    "finished_at": { "$ref": "common.schema.json#/$defs/timestamp" },
    "duration_ms": { "type": "integer", "minimum": 0 },
    "exit_code": { "type": "integer", "minimum": 0, "maximum": 255 },
    "summary": { "type": "string", "minLength": 1, "maxLength": 2048 },
    "errors": {
      "type": "array",
      "items": { "$ref": "error.schema.json" }
    },
    "evidence": {
      "type": "array",
      "items": { "$ref": "common.schema.json#/$defs/evidenceRef" }
    },
    "data": { "type": "object", "additionalProperties": true }
  },
  "allOf": [
    {
      "if": { "properties": { "outcome": { "enum": ["PASS", "SKIPPED"] } }, "required": ["outcome"] },
      "then": {
        "properties": {
          "exit_code": { "const": 0 },
          "errors": { "maxItems": 0 }
        }
      }
    },
    {
      "if": { "properties": { "outcome": { "const": "BLOCKED" } }, "required": ["outcome"] },
      "then": {
        "properties": {
          "exit_code": { "const": 4 },
          "errors": { "minItems": 1 }
        }
      }
    },
    {
      "if": { "properties": { "outcome": { "const": "FAIL" } }, "required": ["outcome"] },
      "then": {
        "properties": {
          "exit_code": { "enum": [2, 3, 5, 6, 7, 8] },
          "errors": { "minItems": 1 }
        }
      }
    },
    {
      "if": { "properties": { "command": { "properties": { "name": { "const": "clean" } }, "required": ["name"] }, "exit_code": { "not": { "const": 2 } } }, "required": ["command", "exit_code"] },
      "then": {
        "properties": {
          "command": {
            "properties": {
              "arguments": {
                "type": "object",
                "additionalProperties": false,
                "required": ["project", "list"],
                "properties": {
                  "project": { "type": "string", "minLength": 1 },
                  "list": { "const": true }
                }
              }
            }
          },
          "data": { "$ref": "clean-data.schema.json" }
        }
      }
    },
    {
      "if": { "properties": { "command": { "properties": { "name": { "const": "detect" } }, "required": ["name"] }, "exit_code": { "not": { "const": 2 } } }, "required": ["command", "exit_code"] },
      "then": { "properties": { "data": { "$ref": "detect-data.schema.json" } } }
    },
    {
      "if": { "properties": { "command": { "properties": { "name": { "const": "doctor" } }, "required": ["name"] }, "exit_code": { "not": { "const": 2 } } }, "required": ["command", "exit_code"] },
      "then": { "properties": { "data": { "$ref": "doctor-data.schema.json" } } }
    },
    {
      "if": { "properties": { "command": { "properties": { "name": { "enum": ["export", "build"] } }, "required": ["name"] }, "exit_code": { "not": { "const": 2 } } }, "required": ["command", "exit_code"] },
      "then": {
        "properties": {
          "command": {
            "properties": {
              "arguments": {
                "type": "object",
                "additionalProperties": false,
                "required": ["project", "profile", "preset", "target", "timeout_ms", "engine_user_data", "godot_source"],
                "properties": {
                  "project": { "const": "." },
                  "profile": { "type": "string", "enum": ["debug", "release"] },
                  "preset": { "const": "macOS Technical" },
                  "target": { "const": "macos-universal2" },
                  "timeout_ms": { "type": "integer", "minimum": 1, "maximum": 3600000 },
                  "engine_user_data": { "type": "string", "enum": ["not-authorized", "standard-os-location"] },
                  "godot_source": { "type": "string", "enum": ["explicit", "discovery"] },
                  "mode": { "type": "string", "enum": ["manual", "standard", "strict"] }
                }
              }
            }
          },
          "data": { "$ref": "export-data.schema.json" }
        }
      }
    },
    {
      "if": {
        "properties": {
          "command": { "properties": { "name": { "enum": ["export", "build"] } }, "required": ["name"] },
          "outcome": { "const": "PASS" }
        },
        "required": ["command", "outcome"]
      },
      "then": {
        "properties": {
          "evidence": { "minItems": 1, "maxItems": 1 },
          "data": {
            "properties": {
              "artifact_count": { "const": 1 },
              "engine_version": { "type": "string", "minLength": 1 }
            },
            "required": ["artifact_count", "engine_version"]
          }
        }
      }
    },
    {
      "if": { "properties": { "command": { "properties": { "name": { "enum": ["hooks list", "hooks plan", "hooks status", "hooks install", "hooks uninstall"] } }, "required": ["name"] }, "exit_code": { "not": { "const": 2 } } }, "required": ["command", "exit_code"] },
      "then": {
        "properties": {
          "command": {
            "properties": {
              "arguments": {
                "type": "object",
                "additionalProperties": false,
                "required": ["project"],
                "properties": { "project": { "const": "." } }
              }
            }
          },
          "evidence": { "maxItems": 0 },
          "data": { "$ref": "hooks-data.schema.json" }
        }
      }
    },
    {
      "if": { "properties": { "command": { "properties": { "name": { "const": "initialize" } }, "required": ["name"] }, "exit_code": { "not": { "const": 2 } } }, "required": ["command", "exit_code"] },
      "then": { "properties": { "data": { "$ref": "initialize-data.schema.json" } } }
    },
    {
      "if": { "properties": { "command": { "properties": { "name": { "const": "starter create" } }, "required": ["name"] }, "exit_code": { "not": { "const": 2 } } }, "required": ["command", "exit_code"] },
      "then": {
        "properties": {
          "command": {
            "properties": {
              "arguments": {
                "type": "object",
                "additionalProperties": false,
                "required": ["project"],
                "properties": { "project": { "const": "provided" } }
              }
            }
          },
          "evidence": { "maxItems": 0 },
          "data": { "$ref": "starter-create-data.schema.json" }
        }
      }
    },
    {
      "if": {
        "properties": {
          "command": { "properties": { "name": { "const": "starter create" } }, "required": ["name"] },
          "outcome": { "const": "PASS" }
        },
        "required": ["command", "outcome"]
      },
      "then": {
        "properties": {
          "data": {
            "properties": { "created": { "const": true } },
            "required": ["created", "template_version", "file_count", "expanded_byte_size", "next_command"]
          }
        }
      }
    },
    {
      "if": { "properties": { "command": { "properties": { "name": { "const": "logs" } }, "required": ["name"] }, "exit_code": { "not": { "const": 2 } } }, "required": ["command", "exit_code"] },
      "then": {
        "properties": {
          "command": {
            "properties": {
              "arguments": {
                "type": "object",
                "additionalProperties": false,
                "required": ["project", "run_id"],
                "properties": {
                  "project": { "const": "." },
                  "run_id": { "type": "string", "pattern": "^atelier-[0-9]{8}t[0-9]{6}\\.[0-9]{9}z-[a-f0-9]{12}$" }
                }
              }
            }
          },
          "evidence": { "maxItems": 0 },
          "data": { "$ref": "logs-data.schema.json" }
        }
      }
    },
    {
      "if": {
        "properties": {
          "command": { "properties": { "name": { "const": "logs" } }, "required": ["name"] },
          "outcome": { "const": "PASS" }
        },
        "required": ["command", "outcome"]
      },
      "then": {
        "properties": {
          "data": {
            "properties": {
              "events": { "minItems": 1 }
            }
          }
        }
      }
    },
    {
      "if": { "properties": { "command": { "properties": { "name": { "const": "release check" } }, "required": ["name"] }, "exit_code": { "not": { "const": 2 } } }, "required": ["command", "exit_code"] },
      "then": {
        "properties": {
          "command": {
            "properties": {
              "arguments": {
                "oneOf": [
                  {
                    "type": "object",
                    "additionalProperties": false,
                    "required": ["project"],
                    "properties": { "project": { "const": "." } }
                  },
                  {
                    "type": "object",
                    "additionalProperties": false,
                    "required": ["project", "mode"],
                    "properties": {
                      "project": { "const": "." },
                      "mode": { "type": "string", "enum": ["manual", "standard", "strict"] }
                    }
                  }
                ]
              }
            }
          },
          "evidence": { "maxItems": 0 },
          "data": { "$ref": "release-check-data.schema.json" }
        }
      }
    },
    {
      "if": { "properties": { "command": { "properties": { "name": { "const": "status" } }, "required": ["name"] }, "exit_code": { "not": { "const": 2 } } }, "required": ["command", "exit_code"] },
      "then": { "properties": { "data": { "$ref": "status-data.schema.json" } } }
    },
    {
      "if": { "properties": { "command": { "properties": { "name": { "const": "test" } }, "required": ["name"] }, "exit_code": { "not": { "const": 2 } } }, "required": ["command", "exit_code"] },
      "then": {
        "properties": {
          "command": {
            "properties": {
              "arguments": {
                "type": "object",
                "additionalProperties": false,
                "required": ["project", "timeout_ms", "engine_user_data", "godot_source", "test_runner"],
                "properties": {
                  "project": { "const": "." },
                  "timeout_ms": { "type": "integer", "minimum": 1, "maximum": 3600000 },
                  "engine_user_data": { "type": "string", "enum": ["not-authorized", "standard-os-location"] },
                  "godot_source": { "type": "string", "enum": ["explicit", "discovery"] },
                  "test_runner": { "const": "res://tests/atelier_test_runner.gd" }
                }
              }
            }
          },
          "data": { "$ref": "test-data.schema.json" }
        }
      }
    },
    {
      "if": {
        "properties": {
          "command": { "properties": { "name": { "const": "test" } }, "required": ["name"] },
          "outcome": { "const": "PASS" }
        },
        "required": ["command", "outcome"]
      },
      "then": {
        "properties": {
          "data": {
            "properties": {
              "test_count": { "type": "integer", "minimum": 1 },
              "failed_count": { "const": 0 },
              "engine_version": { "type": "string", "minLength": 1 }
            },
            "required": ["test_count", "failed_count", "engine_version"]
          }
        }
      }
    },
    {
      "if": { "properties": { "command": { "properties": { "name": { "const": "validate" } }, "required": ["name"] }, "exit_code": { "not": { "const": 2 } } }, "required": ["command", "exit_code"] },
      "then": {
        "properties": {
          "command": {
            "properties": {
              "arguments": {
                "oneOf": [
                  {
                    "type": "object",
                    "additionalProperties": false,
                    "required": ["project"],
                    "properties": { "project": { "const": "." } }
                  },
                  {
                    "type": "object",
                    "additionalProperties": false,
                    "required": ["project", "headless", "timeout_ms", "engine_user_data", "godot_source"],
                    "properties": {
                      "project": { "const": "." },
                      "headless": { "const": true },
                      "timeout_ms": { "type": "integer", "minimum": 1, "maximum": 3600000 },
                      "engine_user_data": { "type": "string", "enum": ["not-authorized", "standard-os-location"] },
                      "godot_source": { "type": "string", "enum": ["explicit", "discovery"] }
                    }
                  }
                ]
              }
            }
          },
          "data": { "$ref": "validate-data.schema.json" }
        }
      }
    },
    {
      "if": {
        "properties": {
          "command": {
            "properties": {
              "name": { "const": "validate" },
              "arguments": { "properties": { "headless": { "const": true } }, "required": ["headless"] }
            },
            "required": ["name", "arguments"]
          },
          "exit_code": { "not": { "const": 2 } }
        },
        "required": ["command", "exit_code"]
      },
      "then": { "properties": { "data": { "properties": { "scope": { "const": "headless" } } } } }
    },
    {
      "if": {
        "properties": {
          "command": {
            "properties": {
              "name": { "const": "validate" },
              "arguments": { "properties": { "project": { "const": "." } }, "required": ["project"], "maxProperties": 1 }
            },
            "required": ["name", "arguments"]
          },
          "exit_code": { "not": { "const": 2 } }
        },
        "required": ["command", "exit_code"]
      },
      "then": { "properties": { "data": { "properties": { "scope": { "const": "baseline" } } } } }
    }
  ]
}
