{"schema_version":"1.0.0","run_id":"atelier-20260828t130409.705786000z-d2410b2fe1e4","command":{"name":"export","arguments":{"engine_user_data":"standard-os-location","godot_source":"explicit","preset":"macOS Technical","profile":"release","project":".","target":"macos-universal2","timeout_ms":180000}},"outcome":"PASS","started_at":"2026-08-28T13:04:09.705786Z","finished_at":"2026-08-28T13:04:36.298673Z","duration_ms":26592,"exit_code":0,"summary":"Godot macOS technical export passed.","errors":[],"evidence":[{"id":"atelier-20260828t130409.705786000z-d2410b2fe1e4-e0001","path":".gameatelier/runs/atelier-20260828t130409.705786000z-d2410b2fe1e4/evidence/0001-export-artifact.json"}],"data":{"artifact_count":1,"engine_version":"4.7.2.stable.official.ed1daf0bf","preset":"macOS Technical","profile":"release","scope":"godot-export","target":"macos-universal2"}}
