{"schema_version":"1.0.0","run_id":"atelier-20260828t130330.285799000z-ad5745ce94b3","command":{"name":"build","arguments":{"engine_user_data":"standard-os-location","godot_source":"explicit","preset":"macOS Technical","profile":"debug","project":".","target":"macos-universal2","timeout_ms":180000}},"outcome":"PASS","started_at":"2026-08-28T13:03:30.285799Z","finished_at":"2026-08-28T13:03:59.247058Z","duration_ms":28961,"exit_code":0,"summary":"Godot macOS technical build passed.","errors":[],"evidence":[{"id":"atelier-20260828t130330.285799000z-ad5745ce94b3-e0001","path":".gameatelier/runs/atelier-20260828t130330.285799000z-ad5745ce94b3/evidence/0001-export-artifact.json"}],"data":{"artifact_count":1,"engine_version":"4.7.2.stable.official.ed1daf0bf","preset":"macOS Technical","profile":"debug","scope":"godot-export","target":"macos-universal2"}}
