{
  "schema_version": "1.0.0",
  "run_id": "atelier-20260828t130523.164659000z-00f70f8d1ac3",
  "command": {"name": "initialize", "arguments": {}},
  "outcome": "PASS",
  "started_at": "2026-08-28T13:05:23.164659Z",
  "finished_at": "2026-08-28T13:05:23.167782Z",
  "duration_ms": 3,
  "exit_code": 0,
  "summary": "Codex Game Atelier project state is already initialized; no files were changed.",
  "errors": [],
  "evidence": [],
  "data": {
    "initialized": true,
    "created": false,
    "state_path": ".gameatelier/project.json",
    "project_id": "project-1511b20a980788a0bd74f4d807cf2c04",
    "schema_version": "1.0.0",
    "revision": 0,
    "mode": "standard",
    "engine": {"kind": "godot", "requested_version": "4.7.2-stable", "language": "gdscript"},
    "updated_at": "2026-08-28T13:00:05.774898Z"
  }
}
