{
  "schema_version": "1.0.0",
  "run_id": "atelier-20260826t015509.471623000z-45fb9bf3a65d",
  "command": {
    "name": "test",
    "arguments": {
      "engine_user_data": "standard-os-location",
      "godot_source": "explicit",
      "project": ".",
      "test_runner": "res://tests/atelier_test_runner.gd",
      "timeout_ms": 30000
    }
  },
  "outcome": "PASS",
  "started_at": "2026-08-26T01:55:09.471623Z",
  "finished_at": "2026-08-26T01:55:25.66744Z",
  "duration_ms": 16195,
  "exit_code": 0,
  "summary": "GDScript tests passed.",
  "errors": [],
  "evidence": [
    {
      "id": "atelier-20260826t015509.471623000z-45fb9bf3a65d-e0001",
      "path": ".gameatelier/runs/atelier-20260826t015509.471623000z-45fb9bf3a65d/evidence/0001-test-report.json"
    }
  ],
  "data": {
    "engine_version": "4.7.2.stable.official.ed1daf0bf",
    "failed_count": 0,
    "passed_count": 5,
    "scope": "gdscript",
    "test_count": 5
  }
}
