{"schema_version":"1.0.0","run_id":"atelier-20260828t130248.479542000z-523363d1d676","command":{"name":"test","arguments":{"engine_user_data":"standard-os-location","godot_source":"explicit","project":".","test_runner":"res://tests/atelier_test_runner.gd","timeout_ms":30000}},"outcome":"PASS","started_at":"2026-08-28T13:02:48.479542Z","finished_at":"2026-08-28T13:03:10.028405Z","duration_ms":21548,"exit_code":0,"summary":"GDScript tests passed.","errors":[],"evidence":[{"id":"atelier-20260828t130248.479542000z-523363d1d676-e0001","path":".gameatelier/runs/atelier-20260828t130248.479542000z-523363d1d676/evidence/0001-test-report.json"}],"data":{"engine_version":"4.7.2.stable.official.ed1daf0bf","failed_count":0,"passed_count":6,"scope":"gdscript","test_count":6}}
