{
  "schema_version": "1.0.0",
  "run_id": "atelier-20260826t011433.227719000z-e87b041778c2",
  "command": {
    "name": "validate",
    "arguments": {
      "engine_user_data": "standard-os-location",
      "godot_source": "explicit",
      "headless": true,
      "project": ".",
      "timeout_ms": 30000
    }
  },
  "outcome": "PASS",
  "started_at": "2026-08-26T01:14:33.227719Z",
  "finished_at": "2026-08-26T01:14:50.464503Z",
  "duration_ms": 17236,
  "exit_code": 0,
  "summary": "Godot headless project validation passed.",
  "errors": [],
  "evidence": [
    {
      "id": "atelier-20260826t011433.227719000z-e87b041778c2-e0001",
      "path": ".gameatelier/runs/atelier-20260826t011433.227719000z-e87b041778c2/evidence/0001-validation-report.json"
    }
  ],
  "data": {
    "check_count": 8,
    "scope": "headless"
  }
}
