{"schema_version":"1.0.0","run_id":"atelier-20260828t130252.694404000z-82e100ce228e","command":{"name":"validate","arguments":{"engine_user_data":"standard-os-location","godot_source":"explicit","headless":true,"project":".","timeout_ms":30000}},"outcome":"PASS","started_at":"2026-08-28T13:02:52.694404Z","finished_at":"2026-08-28T13:03:15.477502Z","duration_ms":22783,"exit_code":0,"summary":"Godot headless project validation passed.","errors":[],"evidence":[{"id":"atelier-20260828t130252.694404000z-82e100ce228e-e0001","path":".gameatelier/runs/atelier-20260828t130252.694404000z-82e100ce228e/evidence/0001-validation-report.json"}],"data":{"check_count":8,"scope":"headless"}}
